{
  "trace_id": "550e8400-e29b-41d4-a716-446655440000",
  "span_id": "a1b2c3d4e5f6789012345678abcdef01",
  "parent_span_id": "00112233445566778899aabbccddeeff",
  "timestamp": "2024-01-15T09:30:00Z",
  "name": "phase.design",
  "gen_ai.system": "claude",
  "gen_ai.request.model": "sonnet",
  "gen_ai.usage.input_tokens": 100,
  "gen_ai.usage.output_tokens": 50,
  "gen_ai.response.finish_reasons": ["stop"],
  "loker.run_id": "550e8400-e29b-41d4-a716-446655440000",
  "loker.phase": "design",
  "loker.attempt": 0,
  "loker.strategy": "single",
  "loker.aggregator": "first",
  "loker.outcome": "success"
}
